{
  "id": "test-local-fast",
  "enabled": true,
  "transport": {
    "adapter": "openai_compatible",
    "provider": "test-local-runtime",
    "model": "test-local-model-small",
    "base_url": "http://127.0.0.1:11434/v1",
    "credential_ref": "none"
  },
  "capabilities": {
    "reasoning": 0.41,
    "code_generation": 0.55,
    "debugging": 0.38,
    "tool_orchestration": 0.44,
    "long_horizon_execution": 0.29,
    "context_synthesis": 0.47,
    "structured_precision": 0.52,
    "multimodal_reasoning": 0.0
  },
  "affinities": {
    "local_machine_operations": 0.81,
    "writing": 0.4
  },
  "limits": {
    "context_tokens": 65536,
    "max_output_tokens": 8192,
    "tools": true,
    "vision": false,
    "structured_output": true
  },
  "economics": {
    "input_per_million": null,
    "output_per_million": null,
    "cache_read_per_million": null,
    "cache_write_per_million": null,
    "request_fee": null
  },
  "harness": {
    "profile": "local-generalist-v1",
    "version": 2,
    "reasoning_policy": "off",
    "cache_strategy": "none"
  },
  "policy": {
    "privacy_class": "local",
    "experimental": false,
    "allowed_modes": ["balanced", "economy", "session"]
  },
  "evidence": {
    "source_version": "2026-07-26",
    "calibration_dataset": "hermes-routerbench-v1",
    "sample_count": 0
  },
  "context_anchor": false
}
