{
  "id": "test-hosted-general",
  "enabled": true,
  "transport": {
    "adapter": "openai_compatible",
    "provider": "test-aggregator",
    "model": "test-vendor/test-model-large",
    "base_url": "https://test-aggregator.invalid/v1",
    "credential_ref": "env:TEST_PROVIDER_KEY"
  },
  "capabilities": {
    "reasoning": 0.82,
    "code_generation": 0.94,
    "debugging": 0.9,
    "tool_orchestration": 0.88,
    "long_horizon_execution": 0.79,
    "context_synthesis": 0.84,
    "structured_precision": 0.87,
    "multimodal_reasoning": 0.0
  },
  "affinities": {
    "frontend_ui": 0.68,
    "backend_application": 0.92,
    "systems_infrastructure": 0.86,
    "database_sql": 0.79
  },
  "limits": {
    "context_tokens": 400000,
    "max_output_tokens": 64000,
    "tools": true,
    "vision": false,
    "structured_output": true
  },
  "economics": {
    "input_per_million": 3.0,
    "output_per_million": 15.0,
    "cache_read_per_million": 0.3,
    "cache_write_per_million": 3.75,
    "request_fee": 0.0
  },
  "harness": {
    "profile": "openai-coding-v1",
    "version": 1,
    "reasoning_policy": "adaptive",
    "cache_strategy": "provider_session_key"
  },
  "policy": {
    "privacy_class": "cloud",
    "experimental": false,
    "allowed_modes": ["quality", "balanced"]
  },
  "evidence": {
    "source_version": "2026-07-26",
    "calibration_dataset": "hermes-routerbench-v1",
    "sample_count": 0
  },
  "context_anchor": true
}
